{
  "trip_title": "Tokyo family + conference planner",
  "primary_destination": "Tokyo",
  "destinations": [
    {
      "name": "Tokyo",
      "country": "Japan",
      "is_primary": true,
      "base": true
    }
  ],
  "travellers": [
    {
      "name": "Traveller A",
      "role": "Lead traveller",
      "included_in_day_plans": true,
      "notes": "Conference days on 26 to 27 May."
    },
    {
      "name": "Traveller B",
      "role": "Parent",
      "included_in_day_plans": true,
      "notes": "Assume included in general sightseeing unless edited."
    },
    {
      "name": "Traveller C",
      "role": "Sibling",
      "included_in_day_plans": true,
      "notes": "May split off sometimes. Fallbacks included."
    },
    {
      "name": "Traveller D",
      "role": "Relative",
      "included_in_day_plans": true,
      "notes": "May split off sometimes. Fallbacks included."
    }
  ],
  "stay_start_date": "2026-05-21",
  "stay_end_date": "2026-05-29",
  "departure_date": "2026-05-20",
  "final_home_arrival_date": "2026-05-30",
  "transport_legs": [
    {
      "type": "Flight",
      "carrier": "Air New Zealand",
      "route": "Auckland -> Narita",
      "date": "2026-05-21",
      "time_local": "10:15 NZT",
      "booking_ref": "ANON-NZ99",
      "covered_adults": 2,
      "notes": "Outbound e-ticket currently shows 2 adults."
    },
    {
      "type": "Flight",
      "carrier": "Jetstar",
      "route": "Narita -> Brisbane -> Auckland",
      "date": "2026-05-29",
      "time_local": "20:50 JST",
      "booking_ref": "ANON-JQ10",
      "covered_adults": 1,
      "notes": "Visible screenshot shows one named traveller on the return."
    }
  ],
  "accommodation": [
    {
      "name": "Tokyo East Base Hotel",
      "area": "Asakusabashi",
      "check_in_date": "2026-05-21",
      "check_out_date": "2026-05-29",
      "booking_ref": "ANON-HOTEL-01",
      "covered_adults": 3,
      "notes": "Hotel confirmation shows 2 rooms for 3 adults."
    }
  ],
  "bookings": [
    {
      "type": "Hotel",
      "item": "Tokyo East Base Hotel",
      "date": "2026-05-21",
      "time_local": "Check-in 15:00 / out 11:00",
      "area_route": "Asakusabashi",
      "booking_ref": "ANON-HOTEL-01",
      "covered_adults": 3,
      "status": "Booked",
      "action_needed": "Confirm whether a fourth adult is attached to a separate booking.",
      "notes_source": "Uploaded hotel confirmation PDF. 2 rooms, 8 nights, east Tokyo base.",
      "why_it_matters": "The base hotel shapes the whole east-Tokyo routing pattern."
    },
    {
      "type": "Flight",
      "item": "Air New Zealand NZ99 AKL -> Narita",
      "date": "2026-05-21",
      "time_local": "10:15 NZT",
      "area_route": "Auckland -> Narita",
      "booking_ref": "ANON-NZ99",
      "covered_adults": 2,
      "status": "Booked",
      "action_needed": "Confirm how the other two travellers are reaching Tokyo.",
      "notes_source": "Uploaded outbound e-ticket PDF. Bag drop closes 08:45 NZT, arrival 18:15 JST.",
      "why_it_matters": "Locks the arrival timing and how gentle the first night should be."
    },
    {
      "type": "Attraction",
      "item": "Tokyo Skytree",
      "date": "2026-05-24",
      "time_local": "18:00 JST",
      "area_route": "Skytree / Solamachi",
      "booking_ref": "ANON-SKYTREE",
      "covered_adults": 2,
      "status": "Booked",
      "action_needed": "Add 2 tickets or keep the split-plan evening.",
      "notes_source": "User screenshot shows 2 adult tickets at 18:00.",
      "why_it_matters": "Creates a fixed sightseeing and shopping anchor for the evening."
    },
    {
      "type": "Attraction",
      "item": "teamLab Planets",
      "date": "2026-05-25",
      "time_local": "14:30 JST",
      "area_route": "Toyosu",
      "booking_ref": "ANON-TEAMLAB",
      "covered_adults": 2,
      "status": "Booked",
      "action_needed": "Either add coverage or keep the split-plan fallback for the non-ticketed pair.",
      "notes_source": "User screenshot shows 2 adult tickets at 14:30.",
      "why_it_matters": "Shapes the Toyosu afternoon and whether the whole group can move together."
    },
    {
      "type": "Conference",
      "item": "Developer Conference Tokyo",
      "date": "2026-05-26",
      "time_local": "26-27 May",
      "area_route": "Tachikawa",
      "booking_ref": "",
      "covered_adults": 1,
      "status": "Planned",
      "action_needed": "Confirm the attendee pass and where the rest of the group will regroup.",
      "notes_source": "Official event page shows 26 to 27 May 2026 in Tachikawa.",
      "why_it_matters": "Protects the work anchor without pretending the whole group is occupied."
    },
    {
      "type": "Flight",
      "item": "Jetstar NRT -> BNE -> AKL",
      "date": "2026-05-29",
      "time_local": "20:50 JST",
      "area_route": "Narita -> Brisbane -> Auckland",
      "booking_ref": "ANON-JQ10",
      "covered_adults": 1,
      "status": "To confirm",
      "action_needed": "Confirm whether the visible return booking covers only Traveller A.",
      "notes_source": "User screenshot names one traveller on the return itinerary and arrival back to Auckland on 30 May.",
      "why_it_matters": "Sets the end-of-trip buffer and transit planning."
    }
  ],
  "fixed_events": [
    {
      "date": "2026-05-26",
      "anchor": "Developer Conference day 1",
      "area_route": "Tachikawa",
      "why_it_matters": "Protect work time while keeping a nearby family fallback available."
    },
    {
      "date": "2026-05-27",
      "anchor": "Developer Conference day 2",
      "area_route": "Tachikawa",
      "why_it_matters": "Preserve the work block, then regroup for dinner."
    }
  ],
  "daily_rows": [
    {
      "date": "2026-05-20",
      "block": "AM",
      "phase": "Pre-departure",
      "primary_plan": "Final admin sweep. Check passports, insurance, eSIM, medicines, spare glasses, adapters, and screenshots.",
      "fallback_option_1": "Quick pharmacy or travel-shop run for anything missing.",
      "fallback_split_plan": "Save all booking PDFs offline and sort the airport transfer plan.",
      "area_base": "Home",
      "shopping_focus": "Adapter, medicines, spare glasses",
      "fixed_booking_time": "",
      "pace": "Easy",
      "status": "Locked",
      "notes": "Keep the day practical rather than ambitious."
    },
    {
      "date": "2026-05-20",
      "block": "PM",
      "phase": "Pre-departure",
      "primary_plan": "Pack checked bags and carry-on. Put laptop, medicines, glasses, and key documents in carry-on.",
      "fallback_option_1": "Check chargers, camera gear, and travel cards.",
      "fallback_split_plan": "Weigh bags and move non-essential liquids into checked baggage.",
      "area_base": "Home",
      "shopping_focus": "Neck pillow, sling bag, light jacket",
      "fixed_booking_time": "Air New Zealand online check-in opens 10:15 NZT",
      "pace": "Easy",
      "status": "Locked",
      "notes": "Leave room in luggage for return shopping."
    },
    {
      "date": "2026-05-20",
      "block": "Eve",
      "phase": "Pre-departure",
      "primary_plan": "Check in online if available, confirm airport timing, set alarms, and keep the night quiet.",
      "fallback_option_1": "Simple family dinner at home and final cash-card check.",
      "fallback_split_plan": "Print or screenshot flight and hotel confirmations one last time.",
      "area_base": "Home",
      "shopping_focus": "",
      "fixed_booking_time": "",
      "pace": "Easy",
      "status": "Locked",
      "notes": "Treat this as a low-stimulation night."
    },
    {
      "date": "2026-05-21",
      "block": "AM",
      "phase": "Travel",
      "primary_plan": "Head to AKL, clear bag drop before cut-off, and depart on the outbound flight.",
      "fallback_option_1": "Breakfast after security if timing is comfortable.",
      "fallback_split_plan": "Keep airport shopping to true essentials only.",
      "area_base": "Auckland Airport",
      "shopping_focus": "Airport-only basics",
      "fixed_booking_time": "Bag drop closes 08:45 NZT",
      "pace": "Moderate",
      "status": "Locked",
      "notes": "Keep passports and chargers easy to reach."
    },
    {
      "date": "2026-05-21",
      "block": "PM",
      "phase": "Travel",
      "primary_plan": "Long-haul flight. Rest, hydrate, and keep arrival paperwork handy.",
      "fallback_option_1": "Use downtime to tighten the buy list.",
      "fallback_split_plan": "Light conference reading only if energy is good.",
      "area_base": "In flight",
      "shopping_focus": "",
      "fixed_booking_time": "In air",
      "pace": "Easy",
      "status": "Locked",
      "notes": "Nothing heroic on flight day."
    },
    {
      "date": "2026-05-21",
      "block": "Eve",
      "phase": "Travel",
      "primary_plan": "Arrive Narita, clear immigration, reach Asakusabashi, check in, and keep dinner simple.",
      "fallback_option_1": "Convenience-store run and early shower if everyone is flat.",
      "fallback_split_plan": "Skip a sit-down meal if jet lag is rough.",
      "area_base": "Narita -> Asakusabashi",
      "shopping_focus": "None",
      "fixed_booking_time": "Hotel check-in from 15:00",
      "pace": "Moderate",
      "status": "Locked",
      "notes": "Arrival night should stay calm."
    },
    {
      "date": "2026-05-22",
      "block": "AM",
      "phase": "Tokyo",
      "primary_plan": "Akihabara tech start with a flagship electronics browse.",
      "fallback_option_1": "Smaller camera and gadget stores if the main stop is enough.",
      "fallback_split_plan": "Sleep in and start later if jet lag lingers.",
      "area_base": "Akihabara",
      "shopping_focus": "Tech browse, camera gear, gifts",
      "fixed_booking_time": "",
      "pace": "Moderate",
      "status": "Flexible",
      "notes": "Good first full day because it stays indoors and easy."
    },
    {
      "date": "2026-05-22",
      "block": "PM",